product_id,name,category,price,description
101,Trailblazer Backpack,Outdoors,89.99,"Lightweight backpack with ventilated support for day hikes"
102,Coastal Water Bottle,Outdoors,24.00,"Insulated stainless steel bottle, 900ml capacity"
103,Desk Comfort Mat,Office,39.50,"Cushioned standing desk mat with non-slip base"
104,Focus Notebook,Office,15.00,"Dot-grid notebook with 200 recycled pages"
105,Sunset Hoodie,Apparel,64.00,"Soft fleece hoodie available in sizes XS-XL"
106,Marathon Socks,Apparel,12.50,"Moisture-wicking socks designed for running"
107,Studio Earbuds,Electronics,129.00,"Wireless earbuds with active noise cancellation"
108,Roadtrip Charger,Electronics,32.00,"Dual-port USB-C/USB-A fast car charger"
